{
  "$schema": "../../../../schemas/audio-sidecar.schema.json",
  "schema_version": 2,
  "book_id": "exercised-lieberman",
  "duration": "5-minutes",
  "engine": "kokoro-onnx",
  "engine_version": "0.5.0",
  "model": "kokoro-v1.0.onnx",
  "voice": "bf_emma",
  "lang": "en-gb",
  "speed": 1.0,
  "sample_rate": 24000,
  "output_format": "mp3",
  "source_script": "library/books/exercised-lieberman/scripts/5-minutes.md",
  "source_script_sha256": "5abce7eea53df5c506c788f4f55ee8ec225273a0eebfde3a01d8e7de53988356",
  "pronunciation_dictionary_sha256": "2fe3ec28dd1994ff8f73f3ed0d3dcacb4ff89f197f508837bfc49ca3a36ae7c0",
  "pronunciation_terms": [],
  "script_words": 720,
  "audio_seconds": 291.337,
  "measured_wpm": 148.28,
  "generated_at": "2026-08-13T09:36:42.024882+00:00"
}
