{
  "$schema": "../../../../schemas/audio-sidecar.schema.json",
  "schema_version": 2,
  "book_id": "exercised-lieberman",
  "duration": "30-seconds",
  "engine": "kokoro-onnx",
  "engine_version": "0.5.0",
  "model": "kokoro-v1.0.onnx",
  "voice": "bf_emma",
  "lang": "en-gb",
  "speed": 1.0,
  "sample_rate": 24000,
  "output_format": "mp3",
  "source_script": "library/books/exercised-lieberman/scripts/30-seconds.md",
  "source_script_sha256": "e983a2d53283ef9669cbecf986b1cd9f0d1bf861ba56d396a8259183f85381b7",
  "pronunciation_dictionary_sha256": "2fe3ec28dd1994ff8f73f3ed0d3dcacb4ff89f197f508837bfc49ca3a36ae7c0",
  "pronunciation_terms": [],
  "script_words": 78,
  "audio_seconds": 30.017,
  "measured_wpm": 155.91,
  "generated_at": "2026-08-13T09:33:18.696162+00:00"
}
