{
  "$schema": "../../../../schemas/audio-sidecar.schema.json",
  "schema_version": 2,
  "book_id": "the-laws-of-human-nature-greene",
  "duration": "30-seconds",
  "engine": "kokoro-onnx",
  "engine_version": "0.5.0",
  "model": "kokoro-v1.0.onnx",
  "voice": "bf_emma",
  "lang": "en-gb",
  "speed": 1.0,
  "sample_rate": 24000,
  "output_format": "mp3",
  "source_script": "library/books/the-laws-of-human-nature-greene/scripts/30-seconds.md",
  "source_script_sha256": "f371b2fcc537fb631aace45e0b3eb455db2038f34cbae501d17000347b31e664",
  "pronunciation_dictionary_sha256": "2fe3ec28dd1994ff8f73f3ed0d3dcacb4ff89f197f508837bfc49ca3a36ae7c0",
  "pronunciation_terms": [],
  "script_words": 77,
  "audio_seconds": 30.337,
  "measured_wpm": 152.29,
  "generated_at": "2026-08-13T08:06:18.721102+00:00"
}
