{
  "$schema": "../../../../schemas/audio-sidecar.schema.json",
  "schema_version": 2,
  "book_id": "determined-sapolsky",
  "duration": "30-seconds",
  "engine": "kokoro-onnx",
  "engine_version": "0.5.0",
  "model": "kokoro-v1.0.onnx",
  "voice": "bf_emma",
  "lang": "en-gb",
  "speed": 1.0,
  "sample_rate": 24000,
  "output_format": "mp3",
  "source_script": "library/books/determined-sapolsky/scripts/30-seconds.md",
  "source_script_sha256": "d538d56332bb603d07180f7cc0ca09b7672146a6602ab3c631c19963916aa62f",
  "pronunciation_dictionary_sha256": "2fe3ec28dd1994ff8f73f3ed0d3dcacb4ff89f197f508837bfc49ca3a36ae7c0",
  "pronunciation_terms": [],
  "script_words": 75,
  "audio_seconds": 29.975,
  "measured_wpm": 150.13,
  "generated_at": "2026-08-13T09:04:20.687658+00:00"
}
