{
  "$schema": "../../../../schemas/audio-sidecar.schema.json",
  "schema_version": 2,
  "book_id": "how-not-to-age-greger",
  "duration": "30-seconds",
  "engine": "kokoro-onnx",
  "engine_version": "0.5.0",
  "model": "kokoro-v1.0.onnx",
  "voice": "bf_emma",
  "lang": "en-gb",
  "speed": 1.0,
  "sample_rate": 24000,
  "output_format": "mp3",
  "source_script": "library/books/how-not-to-age-greger/scripts/30-seconds.md",
  "source_script_sha256": "b178806410e78fa7865cef5be797828d77d6766ec036fd077c7ccae3eb69c8ea",
  "pronunciation_dictionary_sha256": "2fe3ec28dd1994ff8f73f3ed0d3dcacb4ff89f197f508837bfc49ca3a36ae7c0",
  "pronunciation_terms": [],
  "script_words": 76,
  "audio_seconds": 31.276,
  "measured_wpm": 145.8,
  "generated_at": "2026-08-13T10:06:59.977171+00:00"
}
