{
  "$schema": "../../../../schemas/audio-sidecar.schema.json",
  "schema_version": 2,
  "book_id": "the-let-them-theory-robbins",
  "duration": "30-minutes",
  "engine": "kokoro-onnx",
  "engine_version": "0.5.0",
  "model": "kokoro-v1.0.onnx",
  "voice": "bf_emma",
  "lang": "en-gb",
  "speed": 0.95,
  "sample_rate": 24000,
  "output_format": "mp3",
  "source_script": "library/books/the-let-them-theory-robbins/scripts/30-minutes.md",
  "source_script_sha256": "3ebccbe988c39d4b759d82156858d774d74f43627edf57dad5d53550b0213f6e",
  "pronunciation_dictionary_sha256": "942f4f6bc6c494dd0ead7a463d20b68a075c68d85972c521c86704bbd14d7607",
  "pronunciation_terms": [],
  "script_words": 4338,
  "audio_seconds": 1671.893,
  "measured_wpm": 155.68,
  "generated_at": "2026-08-13T07:48:30.532322+00:00"
}
